Name,Pronunciation,Region,Density,Description,Bio,Animal,Img,Substitute
Shropshire Blue,SHORP-shur-bloo,,,"Crusty bread, grapes","Shropshire Blue is a cow's milk cheese from Great Britain with a rough brown rind, a bright orange interior and blue veining. The flavor is piquant and pairs well with a Port or other dessert wine. Serve the cheese with beer, any big red wine or even Sherry.",Cow,https://www.gourmetsleuth.com/images/default-source/productimages/shropshire-blue-cheese-jpg.jpg,Gorgonzola
Smoked Gouda,,Netherlands,,Grapes,"Smoked Gouda is a semi-hard to hard cow's milk cheese which is creamy and mild with a natural smoked flavor and rich musky aftertaste. The rind is typically brown rather than the yellow rind on the unsmoked version. Use smoked Gouda In recipes, or on a cheese board. Pair the cheese with a good quality beer or for wine lovers try a Bourdeaux. Gouda was named after the Dutch town of Gouda, just outside Rotterdam. It accounts for more than 60% of the cheese produced in Holland and it has a very long history. ",Cow,https://www.gourmetsleuth.com/images/cheese/smokedgouda-gif.gif,smoked Mozzarella
Sonoma Jack,,United States,Semi-Soft,The mild flavor works well with any sweet fruit. Add water crackers and Italian bread.,"Sonoma Jack is a cheese that comes from The United States. This cheese was for the first time introduced by David Jacks in the late nineteenth century. Sonoma Jack is a semi-soft cheese that is made from cow's milk. Today, it is made in a wide range of flavours, including hot pepper. It has a sweet and creamy taste and is similar to the Scottish cheese Dunlop.",Cow,https://www.gourmetsleuth.com/images/cheese/sonomajack-jpg.jpg,Monterey Jack
St Andre cheese,,France,Soft,"Pairs with mos any fruit, French or Italian bread","St Andre Cheese is named for its producer, St. Andre Creamery located in France. This soft ripened triple cream is an amazingly rich and creamy cheese that is made from fresh cow's milk and enriched with pure cream. St. Andre cheese has a bloomy white edible rind and a soft creamy interior similar to Camembert. Its flavor is rich and buttery due to the addition of sweet cream during the cheese making process. This cheese pairs well with pears and Fuji apples.  Serve with crusty bread and a Sauvignon Blanc or even a crisp Chablis.",Cow,https://www.gourmetsleuth.com/images/default-source/dictionary/st_andre-jpg.jpg,Brie
Stilton cheese,STILL-tun,United Kingdom,Semi-Hard,Grapes are a favorite pairing,"Stilton cheese is historically referred to as ""The King of Cheeses"". Stilton is a blue-mould cheese with a rich and mellow flavor and a piquant aftertaste. It has narrow, blue-green veins and a wrinkled rind which is not edible. Stilton is milder than Roquefort or Gorgonzola, and is equally excellent for crumbling over salads or as a dessert cheese, served with a Port Wine. There are two types of Stilton: Blue and White Stilton. White Stilton has not been inoculated with the Penicillium roqueforti mold and is typically found combined with other flavorings or dried fruits. ",,https://www.gourmetsleuth.com/images/food/stilton-gif.gif,Blue cheese
Swiss cheese,,Switzerland,,"Dark seedy bread or crackers, pairs well with most fruits.","A generic term that refers to many varieties of cheese from Switzerland including emmenthaler, Jarlsberg, Gruyere. In the U.S. Swiss cheese is a processed cheese with a mild flavor and large air holes. Swiss cheese can be used on your cheese board but they also melt very well so they are quite versatile and can be used on sandwiches or melted in sauces or toppings for casseroles and other cooked dishes.",,https://www.gourmetsleuth.com/images/default-source/dictionary/swiss-cheese.jpg,Emmenthal
Taleggio cheese,tah-LEDGE-oh,Italy,,"This fine cheese just needs some fresh, ripe fruit like figs or even fresh strawberries. Serve with crusty Italian bread.","Taleggio cheese is a pungent cow's milk cheese from the Lombardy region of Italy. The cheese is cave aged and becomes quite tangy. It is thought that this may be one of the oldest soft cheeses. The cheese has a strong aroma but the flavor is fairly mild. Pair with white or red Burgundy, Barbaresco or even a rich Chardonnay The making of the cheese dates back to the year 1200. Prior to the 1900's the cheese was called ""stracchino"" which means ""tired"" or ""exhausted. The reference is to the tired herds of cattle making their journey from the Alpine pastures back to the plains. The exhausted herd was still able to produce milk for making cheese and thus the term ""stracchino"" was born. Use the cheese on your cheese board or use it melted atop pastas or other hot dishes.",Cow,https://www.gourmetsleuth.com/images/food/taleggio-jpg.jpg,Limburger
Teleme cheese,,United States,,"Goes well with grapes, Italian bread, or plain water crackers. Treat as you would brie.","Sometimes referred to as ""a poor man's brie"" Teleme cheese is similar in texture to domestic brie and contains about 50 percent milk fat. When young, Teleme's texture is soft and creamy and has a tangy flavor.. As it ages, it becomes runnier and stronger in flavor.",,https://www.gourmetsleuth.com/images/cheese/teleme_300-jpg.jpg,Brie
Tillamook Cheese,,United States,Hard,Dark beers work well,"Tillamook Cheddar is an American cheese that is made from cow's milk. The cheese is made using milk that has been heat-treated rather than pasteurized, a process that allows some of the bacteria essential for producing top quality Cheddar to be retained. According to its texture, it ranks among hard cheeses and is also suitable for vegetarians. Tillamook Cheddar is either white or annatto-coloured and is sold in blocks. It is a table cheese but could be used for grating, grilling or baking.",Cow,https://www.gourmetsleuth.com/images/cheese/tillamook-jpg.jpg,Cheddar
Vacherin,vasher-ANN,Switzerland,,"Serve with thick slices of crusty bread and your favorite ""big red"" wine; anything from the Burgundy or Bordeaux regions. Fresh apples and sliced pears are appropriate.","The term Vacherin refers both to several cheeses produced in Switzerland as well as a French dessert. Although there are many dessert variations the traditional version combines fresh fruit and ice cream on a meringue base and shape of the desert is said to be reminiscent of the shape of the cheese. [Alan Davidson, Oxford Food Companion].",Cow,https://www.gourmetsleuth.com/images/default-source/dictionary/vacherin-fribourgeois-cheese.jpg,Comte
Wensleydale cheese,WENZ-lee-dale,United Kingdom,,"Grapes, some fruits may clash with the blended fruits, table water crackers, crusty bread",Wensleydale is a traditional English hard cheese made from cow's milk. It has a shape of cylinder with natural rind. Wensleydale can be used as table cheese and is very tasty with apple pie. This cheese is based on the recipe that can be traced back to the Cistercian monks who came over with William the Conqueror in the 11 century.,Cow,https://www.gourmetsleuth.com/images/cheese/wensley-gif.gif,Cheshire
Zamorano cheese,zah-moh-RAH-noh,Spain,,Quince paste,"Zamarano Cheese is made from both pasteurized and unpasteurized milk of Churra sheep from the small town of Zamora, Spain. Zamarano is similar to Manchego and provides a nice nutty, ""sheep"" flavor. Serve Zamarano cheese with fresh melon, ham, pears and even tomatoes.  Serve crusty bread alongside and serve a full bodied red wine.",Sheep,https://www.gourmetsleuth.com/images/default-source/productimages/zamorano-sheep-cheese.jpg,Manchego